{"fixture_id":"FVEDH-R1-SCHEMA-001","surface":"ordinary_cast","synthetic":true,"official_material":false,"initial_state":{"active_player":"P1","priority_player":"P1","zones":{},"stack":[],"commander":{"name":"Animar, Soul of Elements","zone":"command","tax":0}},"decision":{"action":"pass_priority","supported":true},"expected":{"result":"accept"}}